Date,Content,Source
2024-07-28 15:00:00,Trực tiếp Olympic Paris 2024 chung kết bắn súng: Trịnh Thu Vinh tranh huy chương vàng.,https://vtcnews.vn/truc-tiep-olympic-paris-2024-trinh-thu-vinh-tranh-hcv-ban-sung-ar885998.html
2024-07-28 13:23:00,Lãnh đạo TP Hội An (Quảng Nam) lên tiếng trước thông tin Chùa Cầu không giữ được vẻ cổ kính sau khi trùng tu.,https://vtcnews.vn/chua-cau-la-lam-sau-trung-tu-lanh-dao-tp-hoi-an-noi-gi-ar885946.html
2024-07-28 13:11:00,"Trong chưa đầy nửa ngày tại Kon Tum liên tiếp xảy ra 4 trận động đất, trong đó trận gần nhất có độ lớn 5 độ gây rung lắc nhẹ tại một số địa phương ở miền Trung.",https://vtcnews.vn/dong-dat-lien-tiep-o-kon-tum-gay-rung-lac-o-nhieu-tinh-thanh-ar885964.html
2024-07-28 14:35:00,Bà Nguyễn Thị Nhung - cựu HLV trưởng đội tuyển bắn súng Việt Nam chia sẻ về khả năng giành huy chương Olympic của xạ thủ Trịnh Thu Vinh.,https://vtcnews.vn/chuyen-gia-trinh-thu-vinh-da-luyen-loat-ban-chung-ket-rat-nhieu-lan-ar885988.html
2024-07-27 21:21:00,"Báo điện tử VTC News trân trọng giới thiệu bài viết của Thủ tướng Phạm Minh Chính: ""Đất nước ta chưa bao giờ có được cơ đồ tiềm lực, vị thế và uy tín quốc tế như ngày nay"".",https://vtcnews.vn/dat-nuoc-ta-chua-bao-gio-co-duoc-co-do-tiem-luc-vi-the-va-uy-tin-quoc-te-nhu-ngay-nay-ar884696.html
2024-07-28 16:47:34,"Nước lũ rút chậm và vẫn ngập sâu khiến hàng nghìn gia đình ở một số huyện Hà Nội phải sống trong cảnh không điện, không nước sạch, người dân phải chèo thuyền đi lại.",https://vtcnews.vn/bi-co-lap-vi-nuoc-lu-dan-ha-noi-song-canh-khong-dien-nuoc-cheo-thuyen-vao-lang-ar885973.html
2024-07-28 17:05:54,"Tàu SE11 trên đường từ Hà Nội Vào TP.HCM, khi di chuyển từ Ga Lăng Cô (Huế) vào Đà Nẵng thì bị trật bánh, làm tuyến đường sắt Bắc - Nam tê liệt tạm thời.",https://vtcnews.vn/tau-se11-trat-banh-o-thua-thien-hue-duong-sat-bac-nam-te-liet-tam-thoi-ar886009.html
2024-07-28 09:30:00,"Những năm đầu của cuộc thi Hoa hậu Việt Nam, phần thưởng dành cho các Hoa hậu khá thú vị.",https://vtcnews.vn/phan-thuong-cho-hoa-hau-viet-nam-nguoi-duoc-xe-mifa-nguoi-co-nua-ty-dong-ar884643.html
2024-07-28 09:11:00,"Sau cuộc đại trùng tu, Chùa Cầu - biểu tượng xuyên suốt 4 thế kỷ của Hội An - khoác lên mình ""tấm áo mới"" khiến nhiều người thấy lạ lẫm.",https://vtcnews.vn/nhieu-nguoi-la-lam-voi-dien-mao-moi-cua-chua-cau-400-nam-tuoi-o-hoi-an-ar885932.html
2024-07-28 15:38:58,Xem trực tiếp bóng chuyền nam U20 Việt Nam vs U20 Đài Loan (Trung Quốc) thuộc giải U20 châu Á 2024.,https://vtcnews.vn/xem-truc-tiep-bong-chuyen-u20-viet-nam-vs-u20-dai-loan-trung-quoc-ar886003.html
2024-07-28 17:02:02,"Chiều 28/7, Sở Y tế Bình Thuận cho biết,  tại Mũi Né (TP Phan Thiết) có 48 du khách nhập viện do nghi ngờ ngộ độc thực phẩm.",https://vtcnews.vn/48-du-khach-nhap-vien-do-nghi-bi-ngo-doc-thuc-pham-o-mui-ne-ar886008.html
2024-07-28 15:15:28,36 người đẹp tại Miss Grand Vietnam 2024 đã có màn khoe sắc cuốn hút trong bộ ảnh mới trước khi bước vào những đêm thi quan trọng.,https://vtcnews.vn/thi-sinh-miss-grand-vietnam-2024-do-nhan-sac-truoc-them-chung-ket-ar885997.html
2024-07-28 14:49:18,Đoàn thể thao Việt Nam tiếp tục đón tin vui khi VĐV Phạm Thị Huệ lọt vào tứ kết Olympic rowing  nội dung thuyền đơn hạng nặng.,https://vtcnews.vn/pham-thi-hue-gianh-ve-vao-tu-ket-rowing-olympic-2024-ar885990.html
2024-07-28 14:40:38,Bé Luyến không phải nhân vật chính trong phim “Của để dành” nhưng đã để lại nhiều ấn tượng với khán giả sau phân cảnh trò chuyện với cái bóng của chính mình.,https://vtcnews.vn/be-luyen-phim-cua-de-danh-ngay-ay-bay-gio-ra-sao-ar885984.html
2024-07-28 14:40:31,"Theo Cal Fire, tính đến 27/7, cháy rừng ở California thiêu rụi hơn 626.000 mẫu Anh (tương đương với 253.000 ha).",https://vtcnews.vn/chay-rung-nhieu-ngay-o-my-thieu-rui-hon-200-000-ha-ar885987.html
2024-07-28 14:01:49,"Cơ quan công an đã khởi tố vụ án, khởi tố bị can đối với thủ quỹ Trường Chính trị Đắk Lắk, để điều tra về hành vi tham ô tài sản.",https://vtcnews.vn/khoi-to-vu-an-tham-o-tai-san-tai-truong-chinh-tri-dak-lak-ar885986.html
2024-07-28 14:13:40,"Mồng tơi là món rau yêu thích của nhiều gia đình trong những ngày hè, nhưng khi ăn phải lưu ý một số điều nếu không muốn hại đến cơ thể.",https://vtcnews.vn/rau-mong-toi-thanh-mat-ngay-he-nhung-khi-an-can-luu-y-nhung-dieu-nay-ar885965.html
2024-07-28 14:10:00,Tham khảo điểm chuẩn xét tuyển vào Học viện Báo chí và Tuyên truyền (Hà Nội) trong 5 năm gần nhất.,https://vtcnews.vn/diem-chuan-hoc-vien-bao-chi-va-tuyen-truyen-5-nam-gan-nhat-ar885811.html
2024-07-28 13:44:19,"Tối 21/7, anh Vũ Duy Phong liên lạc với gia đình, sau đó điện thoại tắt nguồn rồi mất liên lạc.",https://vtcnews.vn/tim-kiem-nam-sinh-cao-dang-y-duoc-mat-tich-7-ngay-ar885978.html
2024-07-28 12:30:00,"Mẫu máy bay lai trực thăng Racer của Airbus đạt tốc độ hành trình 418km/h chưa đầy hai tháng sau chuyến bay đầu tiên, đánh dấu thành tựu lớn trong ngành hàng không.",https://vtcnews.vn/mau-may-bay-lai-truc-thang-cua-airbus-dat-thanh-tuu-lon-ve-toc-do-ar885893.html
2024-07-28 14:00:00,Các mẹo tránh ngứa tay khi gọt khoai sọ dưới đây sẽ giúp bạn thoải mái chế biến những món ăn ngon từ khoai sọ mà không lo lắng về tình trạng ngứa ngáy khó chịu.,https://vtcnews.vn/meo-tranh-ngua-tay-khi-got-khoai-so-ar885576.html
2024-07-28 12:02:00,Cập nhật mới nhất bảng tổng sắp huy chương Olympic 2024 hôm nay 28/7.,https://vtcnews.vn/bang-tong-sap-huy-chuong-olympic-2024-hom-nay-28-7-ar885957.html
2024-07-28 13:30:48,"Cục Thuế Bình Dương và Bình Phước vừa đề nghị tạm hoãn thực hiện thủ tục xuất cảnh đối với các giám đốc, người đại diện pháp luật nhiều công ty vì nợ thuế quá hạn.",https://vtcnews.vn/tam-hoan-xuat-canh-nhieu-giam-doc-doanh-nghiep-ar885974.html
2024-07-28 13:26:07,Tập đoàn ô tô hàng đầu thế giới Stellantis có thể sẽ dừng hoạt động đối với một số thương hiệu ô tô nếu không tạo ra lợi nhuận.,https://vtcnews.vn/nhieu-thuong-hieu-o-to-noi-tieng-cua-stellantis-co-nguy-co-bi-khai-tu-ar885969.html
2024-07-28 11:50:00,"Sắp hết thời gian đăng ký nguyện vọng, nhiều trường đại học đào tạo khối ngành Sư phạm đã ra thông báo điều chỉnh chỉ tiêu tuyển sinh năm 2024.",https://vtcnews.vn/nhieu-truong-dai-hoc-quay-xe-giam-manh-chi-tieu-nganh-su-pham-ar885931.html
2024-07-28 11:30:52,"Trứng là một trong những thực phẩm quen thuộc trong bữa ăn của người Việt, trứng ngon, rẻ lại bổ dưỡng với sức khoẻ, vậy ăn trứng vịt hay trứng gà tốt hơn?",https://vtcnews.vn/an-trung-vit-hay-trung-ga-tot-hon-ar885780.html
2024-07-28 11:04:00,Do bận rộn nên nhiều bà nội trợ thường mua nhiều thịt lợn về cấp đông để dùng dần; vậy thịt lợn để trong tủ lạnh được bao lâu mà vẫn đảm bảo chất lượng?,https://vtcnews.vn/thit-lon-de-trong-tu-lanh-duoc-bao-lau-ar885183.html
2024-07-28 09:58:23,HLV trưởng đội tuyển nữ Canada - bà Bev Priestman bị cấm chỉ đạo 1 năm sau bê bối thăm dò tuyển New Zealand bằng drone hôm 22/7.,https://vtcnews.vn/tuyen-nu-canada-bi-tru-6-diem-hlv-nhan-an-cam-hanh-nghe-1-nam-ar885941.html
2024-07-28 12:55:00,Câu đố tìm hình tam giác được đăng tải trên mạng xã hội đố bạn tìm ra đáp án chính xác và thuyết phục nhất.,https://vtcnews.vn/10-nguoi-thi-9-nguoi-tra-loi-sai-cau-do-dem-so-tam-giac-nay-ar885944.html
2024-07-28 09:37:20,"Được xây dựng từ khoảng 5.000 năm trước ở Salisbury, Wiltshire, Anh, bãi đá cổ Stonehenge bao gồm 100 tảng đá thẳng đứng khổng lồ được sắp xếp theo bố cục hình tròn.",https://vtcnews.vn/giai-ma-bi-an-stonehenge-bai-da-co-noi-tieng-cua-nuoc-anh-ar885895.html
2024-07-28 09:46:58,"Người phụ nữ tên Zeng bị nam đồng nghiệp vỗ vào lưng khi đang ngủ, dẫn đến việc cô gặp chấn thương ở đĩa đệm cột sống và phải nghỉ làm trong 1 năm.",https://vtcnews.vn/bi-dong-nghiep-vo-vao-lung-nguoi-phu-nu-chan-thuong-phai-nghi-lam-1-nam-ar885936.html
2024-07-28 10:44:14,"Ngoại trưởng Blinken và Bộ trưởng Quốc phòng Mỹ Lloyd Austin dự kiến sẽ có cuộc hội đàm ""2+2"" với những người đồng cấp Nhật Bản Yoko Kamikawa và Minoru Kihara.",https://vtcnews.vn/ngoai-truong-my-toi-nhat-de-cung-co-lien-minh-tai-chau-a-thai-binh-duong-ar885948.html
2024-07-28 09:24:39,"Trong tập 4 ""Anh trai vượt ngàn chông gai"", Bằng Kiều khóc nghẹn khi chia sẻ tâm sự người làm cha, Tuấn Hưng nhận lỗi vì đội mình rơi vào vòng nguy hiểm.",https://vtcnews.vn/anh-trai-vuot-ngan-chong-gai-tap-4-bang-kieu-khoc-nghen-tuan-hung-nhan-loi-ar885935.html
2024-07-28 09:10:34,"Cập nhật lịch thi đấu Olympic Paris 2024 hôm nay 28/7: Trịnh Thu Vinh, Lê Thị Mộng Tuyền (bắn súng) và Phạm Thị Huệ (rowing).",https://vtcnews.vn/lich-thi-dau-olympic-ngay-28-7-thu-vinh-san-vang-mong-tuyen-nhap-cuoc-ar885937.html
2024-07-28 09:10:00,"Các trường đại học khối ngành Kinh tế dự báo mức điểm chuẩn năm sẽ tăng nhẹ so với năm trước, do phổ điểm các khối A00, A01, D01 và D07 đều tăng.",https://vtcnews.vn/du-bao-diem-chuan-cac-truong-dai-hoc-khoi-nganh-kinh-te-2024-ar885933.html
2024-07-27 16:51:53,"Từ sáng sớm 27/7, tại nghĩa trang Mai Dịch (Hà Nội), đông đảo người dân đem theo nến, hương, hoa để dâng lên tưởng nhớ, tri ân các anh hùng liệt sỹ.",https://vtcnews.vn/nguoi-dan-dang-huong-tri-an-anh-hung-liet-si-tai-nghia-trang-mai-dich-ar885845.html
2024-07-27 14:35:35,"Hàng nghìn người từ khắp cả nước đổ về Ngã ba Đồng Lộc (Hà Tĩnh) để dâng hương, tưởng niệm các liệt sỹ đã hy sinh tại nơi này.",https://vtcnews.vn/nguoi-dan-doi-nang-40-do-ve-nga-ba-dong-loc-dang-huong-ar885825.html
2024-07-27 05:35:41,Lễ khai mạc Olympic Paris 2024 diễn ra với nhiều điểm nhấn và kéo dài trong 4 giờ đồng hồ.,https://vtcnews.vn/khai-mac-olympic-paris-2024-keo-dai-4-tieng-an-tuong-chua-tung-co-ar885759.html
2024-07-26 16:25:00,"Sau Lời điếu của Chủ tịch nước Tô Lâm, các lãnh đạo Đảng, Nhà nước cùng gia quyến đi quanh linh cữu Tổng Bí thư Nguyễn Phú Trọng, chào tiễn biệt ông lần cuối.",https://vtcnews.vn/hinh-anh-xuc-dong-trong-le-truy-dieu-tong-bi-thu-nguyen-phu-trong-ar885690.html
2024-07-25 21:02:00,"Với đôi nạng thép, ông Đoàn Tấn Phụ vượt quãng đường gần 900km, chờ đợi nhiều giờ đồng hồ để vào viếng Tổng Bí thư Nguyễn Phú Trọng trong ngày Quốc tang.",https://vtcnews.vn/ong-lao-chong-nang-vuot-gan-900km-ra-ha-noi-vieng-tong-bi-thu-nguyen-phu-trong-ar885526.html
2024-07-25 19:38:00,Một số địa điểm ở TP.HCM đã lập bàn thờ tưởng niệm Tổng Bí thư Nguyễn Phú Trọng.,https://vtcnews.vn/nhieu-noi-tai-tp-hcm-lap-ban-tho-tuong-niem-tong-bi-thu-nguyen-phu-trong-ar885524.html
2024-07-25 10:50:00,"Đại sứ quán Việt Nam tại nhiều nước đã treo cờ rủ, tổ chức lễ viếng và mở sổ tang tưởng niệm Tổng Bí thư Đảng Cộng sản Việt Nam Nguyễn Phú Trọng.",https://vtcnews.vn/dai-su-quan-viet-nam-o-nuoc-ngoai-to-chuc-le-vieng-tong-bi-thu-nguyen-phu-trong-ar885343.html
2024-07-25 10:05:00,"Trong ngày đầu Quốc tang, các nước cử đại diện cấp cao tới Hà Nội và dự Lễ viếng Tổng Bí thư Nguyễn Phú Trọng.",https://vtcnews.vn/cac-doan-quoc-te-vieng-tong-bi-thu-nguyen-phu-trong-ar885352.html
2024-07-25 09:45:00,"Ở khu vực phía Nam, Lễ viếng Tổng Bí thư Nguyễn Phú Trọng được tổ chức tại Hội trường Thống Nhất (Quận 1, TP.HCM).",https://vtcnews.vn/nguoi-dan-mien-nam-vieng-tong-bi-thu-nguyen-phu-trong-ar885330.html
2024-07-24 10:15:00,"Tình trạng ngập lụt ở Hà Nội kéo dài từ hôm qua đến sáng nay khiến giao thông tê liệt, hàng loạt xe chết máy, tài xế đứng giữa đường gọi điện cầu cứu người thân.",https://vtcnews.vn/ha-noi-ngap-lut-khap-noi-dan-chon-chan-giua-bien-nuoc-cau-cuu-nguoi-than-ar885091.html
2024-07-24 08:15:00,"Nước lũ cuồn cuộn đổ về trong đêm nhấn chìm nhiều tuyến đường ở TP Sơn La, có nơi nước ngập hơn 1m khiến người dân vội vã chạy lụt, sơ tán.",https://vtcnews.vn/lu-cuon-cuon-do-ve-nguoi-son-la-thau-dem-chay-lut-ar885060.html
2024-07-24 07:00:00,"Nhắc về Tổng Bí thư Nguyễn Phú Trọng, những người hàng xóm lại nhớ căn nhà tập thể 25m² với góc ban công xanh mát và biệt tài gói bánh chưng rất đẹp của ông.",https://vtcnews.vn/can-nha-tap-the-25m-noi-gia-dinh-tong-bi-thu-nguyen-phu-trong-tung-sinh-song-ar884725.html
2024-07-23 18:51:00,"Chiều 23/7, rất đông người dân đến chùa Quán Sứ (quận Hoàn Kiếm, Hà Nội) thắp nén hương tưởng nhớ, tỏ lòng biết ơn Tổng Bí thư Nguyễn Phú Trọng.",https://vtcnews.vn/nguoi-dan-den-chua-quan-su-tuong-nho-tong-bi-thu-nguyen-phu-trong-ar884949.html
2024-07-23 16:09:57,"Hà Nội mưa cả ngày không ngớt khiến một số tuyến đường ngập nặng, ô tô, xe máy bì bõm ""bơi"" trong biển nước.",https://vtcnews.vn/ha-noi-mua-tu-sang-den-chieu-xe-co-bi-bom-boi-tren-duong-ar884945.html
2024-07-23 06:30:00,"Trên phố cổ Hà Nội, những mặt bằng có diện tích siêu nhỏ, chỉ vài m2 vẫn được tận dụng làm nơi kinh doanh với giá cho thuê vô cùng đắt đỏ.",https://vtcnews.vn/nhung-mat-bang-kinh-doanh-sieu-nho-sieu-dat-ngu-tren-dat-vang-ha-noi-ar879690.html
2024-07-22 06:52:00,"Hàng nghìn tấn rác thải ùn ứ sau khi lò đốt Phượng Thành (Đức Thọ, Hà Tĩnh) dừng hoạt động chất thành từng đống cao như núi, gây ô nhiễm môi trường nghiêm trọng.",https://vtcnews.vn/nui-rac-thai-quay-quanh-lo-dot-6-ty-dong-dap-chieu-o-ha-tinh-ar884605.html
2024-07-21 19:49:00,"Trước ngày diễn ra Quốc tang, nhiều cơ quan, công sở, nhà dân ở Hà Nội đã treo cờ rủ để tưởng nhớ Tổng Bí thư Nguyễn Phú Trọng.",https://vtcnews.vn/nhieu-noi-treo-co-ru-som-tuong-nho-tong-bi-thu-nguyen-phu-trong-ar884596.html
2024-07-20 19:34:00,"Chiều nay (20/7), Tổng Bí thư, Chủ tịch Trung Quốc Tập Cận Bình đã đến Đại sứ quán Việt Nam tại Trung Quốc viếng Tổng Bí thư Nguyễn Phú Trọng.",https://vtcnews.vn/tong-bi-thu-chu-tich-trung-quoc-tap-can-binh-vieng-tong-bi-thu-nguyen-phu-trong-ar884481.html
2024-07-20 17:02:00,Nhiều người dân làng Lại Đà không cầm được nước mắt khi nhớ về người con ưu tú của quê hương - Tổng Bí thư Nguyễn Phú Trọng.,https://vtcnews.vn/nguoi-dan-lang-co-lai-da-roi-nuoc-mat-ke-ve-tong-bi-thu-nguyen-phu-trong-ar884413.html
2024-07-19 16:34:57,"Sau 8 năm “lỡ hẹn”, cầu vượt ngã tư Bốn Xã được đề xuất khởi động lại với tổng vốn gần 2.400 tỷ đồng nhằm giải cứu ùn tắc giao thông.",https://vtcnews.vn/can-canh-nut-giao-nga-tu-bon-xa-sap-duoc-tp-hcm-xay-cau-vuot-2-400-ty-ar884228.html
